Soft climate change denial,"gareth redmond - king , wwf 's head of climate change",expert familiar with heede ’s research and the politic of climate change,"robert n. stavins , the director of the environmental economic program at harvard university who be in china recently to discuss climate change","a report in september by david mackay , the chief scientific adviser at the department of energy and climate change",a change of a couple of shareholder ' vote,a video that use a discussion of sport dope to explain the probability aspect of climate change,"david fenton , the founder of fenton , the social change communication agency that produce the ad",the national security risk of project climate change,"michael mann , a lead climate scientist and professor of meteorology at penn state university","sen. john barrasso ( r - wyo . ) , one of congress ’ fierce opponent of take official action on climate change",president donald trump ’s withdrawal of the us from the paris climate agreement,organiser of the un - sponsor cop21 climate conference in paris,"climate depot , run by the conservative non - profit committee for a constructive tomorrow ( cfact )",climate and economic - justice organizing across the country,"the combination of "" the climate change "" and earth ’s grow human population be a recipe for disaster",european union climate commissioner miguel arias cañete,93 % of actively publish climate scientist,venezuela ’s lead climate negotiator claudia salerno,the lead nasa climate scientist prof jim hansen,georgia tech climate scientist kim cobb,a large leak could harm the climate and local population,independent climate researcher nick lewis,-pron- ’s not simply that -pron- want to understand the rule of the climate system ....,"physicist john schellnhuber , founder of the potsdam institute for climate impact research in germany",even be the doomi of doomsday prediction about climate change and rise sea level to come true,"jon costantino , a former climate change planner at the california air resources board who be now a senior adviser to the sacramento law firm manatt , phelps & phillips",greenpeace usa climate director janet redman,a new united nations report on climate change,step forward australian climate scientist professor chris turney,friend of the earth climate campaigner asad rehman
Udo Hemmelgarn
Tobacco industry playbook,industry opponent of the obama administration ’s aggressive use of executive power to push new regulation,"aloulou fawzi , an eia industry economist","richard knight , deputy chief engineer at the government and industry - back energy technologies institute ( eti )",this party — and the industry that be push a lot of these — be so against the idea of regulation in general,"john raquet , the ceo and founder of industry publication gasworld","the gop , oil industry and other backer","mr. trump , who campaign on a pledge to revive the coal industry","unilever , often a leader in corporate sustainability , be now the big obstacle to change in the palm oil industry","environmentalist , who often compare fossil fuel company to the tobacco industry","two trade group represent the oil industry , the american petroleum institute and the american fuel & petrochemical manufacturers",co. inc. senior analyst who cover the oil and gas industry,some of the industry that be deny that there be a problem,bafta head of industry sustainability aaron matthews,"prozanski support the state 's emerge cannabis industry and think oregon "" can and should be an export state",recent c.e.o. report put out by the u.n. and organize by munich reid which be one of the major insurance industry of the world,"lisa linowes , executive director of wind action , a new hampshire - base action group that “ counter ” information from the "" wind energy industry and various environmental group , ""","laura sheehan , senior vice president for communication of the coal - industry - back american coalition for clean coal electricity","several senate democrats , such as mark begich ( alaska ) and mary landrieu ( louisiana ) , who be friendly to the oil and gas industry that dominate -pron- state",-pron- ask people in fossil fuel industry,a number of conservative and industry - align group like heritage foundation and the american legislative exchange council,"jesse gilbert , senior industry analyst with snl energy in charlottesville , virginia , who author -pron- new study",-pron- ask a car industry analyst to explain the shift to crossover,oklahoma earthquake in area of high industry waste water disposal,"marshal cohen , chief retail industry analyst at the npd group , a research and consult specialist",eu industry commissioner guenter verheugen,anything less than immediately cease these investment in the fossil fuel industry,"industry trade group , include the edison electric institute that represent duke energy co. , entergy corp. , southern co. and other utility","top soviet and american scientist , environmentalist , policymaker , industry leader and artist today",a substantial contribution of u.s. shale gas industry to the recent methane atmospheric increase,-pron- ’s not a case where the industry be hand -pron- a check
Mark Callahan,prof . mark lilla of columbia,mark s. davis of tulane university law school,thomas malone and mark klein of mit,marine ecologist mark hixon of oregon state university,defense department spokesman mark wright,"writer like bill mckibben , naomi klein , mark hertsgaard , james hansen , and chris hayes","two researcher , mark jacobson of stanford and mark delucchi of the university of california , davis",… gen. ( mark ) milley,"mark chambers , the director of the mayor ’s office of sustainability",bank of england governor mark carney,movement patriarch daniel callahan,""" study author mark risser of lawrence berkeley national laboratory",economist mark perry of the american enterprise institute,environmental writer mark hertsgaard,"mark ghilarducci , director of the california office of emergency services","the stanford study , conduct by researcher mark jacobson and john ten hoeve",former energy executive mark jacobs,defense secretary mark esper,twitter pinterest shadow climate change minister mark butler,only one person — bp engineer mark hafle —,"mark mckinnon , a senior adviser to americans for carbon dividends",writer mark hertsgaard,university of new hampshire president mark huddleston,u.s. secretary of defense mark esper,u.s. defense secretary mark esper,food journalist mark bittman,mark hertsgaard bob massie,ford ceo mark fields,rep. mark walker ( r - n.c. ),"mark j. butler , a professor at old dominion university"
Andreas Bleck,andreas schmittner from oregon state university,study author andreas borgschulte,"andreas prein , the lead author of the study",the san andreas fault
Tad Murty
Australian Environment Foundation,a trio of researcher at the stockholm environment institute,"claudia kemfert , professor of environment at the hertie school of governance in berlin","jack macy , a senior coordinator for the san francisco department of the environment ’s commercial zero waste program",cassandra goldie from the australian council of social services,"some of mr. bush 's critic in the senate , most notably james m. jeffords of vermont , chairman of the environment and public works committee","the regulatory environment change ( like the united states moratorium , after the deepwater horizon disaster in 2010 , on some offshore drilling ) or if the actual environment change ( melt in the high arctic may put difficult deposit within reach )","stephanie a. kolakowsky - hayner , a physician and chief operating officer of the brain trauma foundation",a joint study by the harvard school of public health and syracuse university center for health and the global environment,step forward australian climate scientist professor chris turney,"senator jim inhofe ( r - ok ) , chairman of the senate environment and public works committee",australian prime minister tony abbott ’s top business adviser maurice newman,"study co - author john harrison , an associate professor at washington state university ’s school of the environment",the united nations specialist agency that play a leading role in international effort to monitor and protect the environment,"brown , director of the new york office of the u.n. environment program",the energy & environment initiative at rice university,abdullahi majeed — maldives ' minister of state for energy and environment —,chris ballard of the australian national university,"jos dings , the director of green campaign group transport & environment ( t&e ) , which publish the leak","vineet kumar , a climate change officer at the center for science and environment , a new delhi nonprofit organization that study farmer ’ problem","dennis van berkel , legal counsel for the urgenda foundation","guillermo rodriguez , the policy and communication director for the san francisco department of environment",""" joseph poore of the department of zoology and the school of geography and environment , oxford university , and co author of the study publish in science",fellow australian billionaire mining magnate clive palmer,"donald j. sterhan , chair of the chamber ’s energy and environment committee",minority democrats on the senate committee on environment and public works,steffen of the climate change institute at australian national university,many political scientist sceptical about the environment,"barbara gottlieb , who direct environment and health program for the washington group physicians for social responsibility","the control - environment fish , who later choose to school with -pron- childhood buddy",heritage foundation energy and environment policy analyst ben lieberman
Global warming conspiracy theory,"a nobel prize win biochemistry professor robert lefkowitz of duke university , the poor performance of greenhouse gas theory in the survey",whatever solution to the problem of global warming,a reasonably widespread scientific consensus about the basic fact of global warming here on earth,"corporation – half - fictitious , semi - immortal behemoth endow with human right in the united states and possess of corrosive global power –","andy howell , a scientist at los cumbres observatory global telescope network","james hansen , the nasa scientist who first testify in 1988 about the peril of global warming",global warming be to be limit within the paris agreement limit,a joint study by the harvard school of public health and syracuse university center for health and the global environment,"a report by the global humanitarian forum , an organization lead by kofi annan , the former united nations secretary general","john schellnhuber , the scientist credit with come up with the goal of keep global warming below 2 degree celsius ( 3.6 degree f )",one of the consequence of global warming be increase wildfire activity in california,co - author anna michalak of the carnegie institution of science 's department of global ecology,"most people , include a majority of republicans , support take action to slow global warming","walter vergara , former leader of the climate global expert group ( get ) at the world bank who have help mastermind the project with wri","the financial stability board , which promote global financial stability for the group of 20 nation","lennard de klerk , director of global carbon , a budapest firm that broker such carbon investment in ukraine , russia and bulgaria","ashish jha , who run the harvard global health institute",some pretty heavy - weight scientist involve in the nas discussionof the global warming issue,"jake schmidt , an expert in global climate negotiation with the natural resources defense council , an advocacy group","gregory h. boyce , the chairman of peabody energy corporation , the nation ’s large coal company and one of the most ardent corporate opponent of effort to address global warming",the advocate of a comprehensive bill to combat global warming,"the scientist , lead by kirk smith , professor of global environmental health at the university of california , berkeley","julio friedmann , a senior research scholar at columbia university ’s center for global energy policy","karina nagin , who work for a global health nonprofit , and be get marry in august","yet despite the city ’s abysmal global ranking , work people from all over pakistan still flock to the city — only to end up on the doorstep of the rich , sometimes as modern slave , sometimes as freelance trash picker",the handful of climate researcher who question the scientific consensus about global warming,critic of the most widely use global average surface temperature dataset,last year 's european heat wave be influence by global warming,"edwin lyman , a physicist and senior scientist for the union of concerned scientists ' global security program","fred singer , emeritus professor at the university of virginia and co - author of a classic global warming denial book"
Sammy Wilson,sammy wilson,then - dup minister sammy wilson ( who be reelect to parliament thursday night ),northern ireland 's environment minister sammy wilson,president woodrow wilson,the biologist e.o. wilson,utah speaker wilson,reporter christopher wilson,"carl wilson , the state lobster biologist with the department of marine resources",linden ellis of the china environment forum at the woodrow wilson center in washington,pic.twitter.com/vvzjmsbkcn — robert wilson ( @planktoncounter ),superintendent carlton wilson,the post ’s scott wilson
Rocío Monasterio
Tim Ball,tim ball,apple ceo tim cook,chief executive tim harris,forbes 's tim worstall,actor tim robbins,governor tim walz ( @govtimwalz ),"richard a. ball , the state ’s agriculture commissioner",environmental activist tim keating of rainforest relief,representative tim ryan of ohio,australian climate scientist tim flannery,company spokesman tim leljedal,— tim dechristopher,tim boersma from brookings,tim geithner,professor tim jackson,rep. tim burchett ( r - tenn . ),"tim nickens , editor of editorial at the tampa bay times",rep. tim ryan ( d - ohio ),president tim schmidt,gov. tim kaine,"tim buckley , director of energy finance study at ieefa",rep. tim ryan of ohio,""" tim lelejdal , a spokesman for southern company",oregon state senator tim knopp,"tim gore , climate policy adviser at british aid group","tim searchinger , a princeton university scholar",announcer tim mccarver,contact ball – as -pron- mention in -pron- original article –,tim worstall,"tim swinehart , a teacher at lincoln high school"
Climate change policy of the George W. Bush administration,"a solar physicist at the harvard - smithsonian center for astrophysics , and -pron- co - author","scad of scientist who think nuclear - waste storage be eminently manageable , include the national academies of sciences , engineering , and medicine","mr. cuylenburg of the resilience project , who travel around australia give talk on way to improve mental health","-pron- ally would not dare call the december meeting a “ summit , "" nato official concede","presidential candidate michael bloomberg on sunday , the day before the national holiday honor martin luther king jr.",tim derk of the t - shirt cannon -pron- help invent when -pron- work as the coyote mascot for the san antonio spurs in the 1990s,"andrew raingold , executive director for the aldersgate group , which have campaign for the mandatory measure","dr. roger a. pielke jr. , an expert on environmental risk at the university of colorado","marshall shepherd , the director of atmospheric sciences program , university of georgia","robert n. stavins , the director of the environmental economic program at harvard university who be in china recently to discuss climate change","that ’s the conclusion of the new study , write by henley and andrew king of the university of melbourne","a nobel prize win biochemistry professor robert lefkowitz of duke university , the poor performance of greenhouse gas theory in the survey","coal- and gas - fire electrical generating plant , and make and drive million of new car","prime minister scott morrison , who have be widely criticize for -pron- delay response to the fire","tom jordan , director of the southern california earthquake center and a co - author of the study","amanda gates , an energy design expert , award - win interior designer , advanced feng shui practitioner and host of the popular podcast home energy design","james morrison , the “ principal oceanographer for the north pole environmental observatory","a report in september by david mackay , the chief scientific adviser at the department of energy and climate change","opponent of duke ’s plan , include environmental group and local renewable energy producer","ralph keeling , who run another monitoring program at the scripps institution of oceanography in san diego","thomas j. pyle , president of the institute for energy research , a think tank that support fossil fuel","david shoemaker , president of the w.t.a. , who oversee the association ’s effort in that country","daniel cohan , an associate professor of civil and environmental engineering at rice university",deniers who serve on the administration 's transition team or who work with regulatory agency like the epa,"dr. cailin r. heinze , an associate professor of nutrition at the cummings school of veterinary medicine at tufts university"
The Republican War on Science,"maria van der hoeven , the executive director of the international energy agency ( iea )","a solar physicist at the harvard - smithsonian center for astrophysics , and -pron- co - author","nikki rothwell , coordinator of the northwest michigan horticultural research center","scad of scientist who think nuclear - waste storage be eminently manageable , include the national academies of sciences , engineering , and medicine","gaynor hartnell , chief executive of the renewable energy association",the second - highest ranking woman in the vatican,expert familiar with heede ’s research and the politic of climate change,"mr. cuylenburg of the resilience project , who travel around australia give talk on way to improve mental health","the colleague , an assistant professor at another university","-pron- ally would not dare call the december meeting a “ summit , "" nato official concede","presidential candidate michael bloomberg on sunday , the day before the national holiday honor martin luther king jr.",deputy chief matt barnes explain the ordinance,tim derk of the t - shirt cannon -pron- help invent when -pron- work as the coyote mascot for the san antonio spurs in the 1990s,"andrew raingold , executive director for the aldersgate group , which have campaign for the mandatory measure","dr. roger a. pielke jr. , an expert on environmental risk at the university of colorado","kaufman , the director of columbia ’s school of international and public affairs","marshall shepherd , the director of atmospheric sciences program , university of georgia","robert n. stavins , the director of the environmental economic program at harvard university who be in china recently to discuss climate change",the people who disagree with -pron- decision to birth strike now,"dr ross thompson , of the institute for applied ecology at the university of canberra","that ’s the conclusion of the new study , write by henley and andrew king of the university of melbourne",juvenile turtle and other animal head toward the oil instead of away from -pron-,"the british , french and german environmental minister","a nobel prize win biochemistry professor robert lefkowitz of duke university , the poor performance of greenhouse gas theory in the survey","prime minister scott morrison , who have be widely criticize for -pron- delay response to the fire","tom jordan , director of the southern california earthquake center and a co - author of the study","durwood zaelke , president of the institute for governance & sustainable development","the experiment , conduct by joao xavier of memorial sloan - kettering cancer center","amanda gates , an energy design expert , award - win interior designer , advanced feng shui practitioner and host of the popular podcast home energy design","the fur , skeleton , tooth , head , lash and whisker of the pup , name dogor"
International Policy Network,"maria van der hoeven , the executive director of the international energy agency ( iea )",progressive push for policy like medicare - for - all and free college tuition,"kaufman , the director of columbia ’s school of international and public affairs",john german of the international council on clean transportation,"thus , large - bodied animal whose body part – include shark fin , rhino horn , and elephant tusk – be trade in international luxury market",how would -pron- china policy differ from president trump ’s,"andy howell , a scientist at los cumbres observatory global telescope network",the international institute for sustainable development,"many establish scientist , academic , economist , and policy expert","charles komanoff , an energy policy analyst who direct the carbon tax center ( pro , obviously )","tom goldtooth , executive director of the indigenous environmental network , base in minnesota",the lead international network of climate change scientist,"laura thomas , the california deputy state director for the national nonprofit drug policy alliance","meagan hatcher - mays , indivisible ’s director of democracy policy","kenneth madsen , an associate geography professor at ohio state university who study international border",a government report on -pron- energy policy,"chai qimin , a senior director at the national center for climate change strategy and international cooperation",a couple hundred young people represent the statewide network students for a just and stable future,"rodolfo de la garza , a professor of public policy at columbia university who study minority voting and election participation","william reilly , former administrator of the u.s. environmental protection agency , 1989 - 1993 , and found partner of aqua international partners , a private equity fund that invest in water and renewable energy",the united nations specialist agency that play a leading role in international effort to monitor and protect the environment,the international civil aviation organization,"urban policy maker , corporate officer , utility executive , and state regulator","a producer for acn , the fictional news network on the show",lester brown of the earth policy institute,"charles brasted , a partner at hogan lovells , an international law firm",the international climate science coalition,"sarah ladislaw , who direct the energy and national security program at the center for international and strategic studies","that ’s also the view of devin hartman , electricity policy manager for the r street institute , a center - right think tank , and a former energy market analyst at the federal energy regulatory commission","debi barker , the center ’s international director"
Rex Jones,[ jones ],kerri - ann jones,mother jones ‘ kevin drum,even prof jones,senior policy advocate mitch jones,baroness jones,"rex tillerson , raymond ’s successor as ceo","mother jones , both man",exxonmobil ceo rex tillerson,former exxonmobil boss rex tillerson,architect susan jones of atelierjones llc,"justin jones , a 38-year - old horse trainer",ceo rex tillerson,jones nor mckibben,exxon 's ceo rex tillerson,flores - jones,"jones , a fervent trump supporter",the cru ’s jones,cnn host van jones,benjamin jones,president serene jones,secretary of state rex w. tillerson,climategate ’s phil jones,pateman - jones of connected kerb,the geneticist steve jones,buzzfeed news dewayne jones,mother jones ‘ shane bauer,rex tillerson ’s,professor jones,"rex tillerson , the ceo and chairman of exxonmobil"
