Donald Trump,donald trump,“ donald trump,donald trump 's,not donald trump,donald trump jr.,donald trump ’s,donald j. trump,md. — president donald trump,president donald trump,donald trump ’s election,president donald trump ’s withdrawal of the us from the paris climate agreement,first son donald trump jr.,– president donald trump,los angeles — president donald trump,trounce donald trump be essential to the preservation of liberal democracy,the great mr. donald trump,presumptive republican presidential nominee donald trump,republican presidential front - runner donald trump,even president donald trump,gop frontrunner donald trump,president donald trump and the gop - dominate congress,united states president donald trump,master troller donald trump,defeat president donald trump,president donald trump ’s administration,donald trump and the republican party,president donald trump ’s handling of the decision to leave,then - candidate donald trump,u.s. president donald trump ’s threat to pull out,billionaire presidential candidate donald trump
Barack Obama,barack obama,barack obama sr,barack obama 's,candidate barack obama,democrats like bill clinton and barack obama,president barack obama 's health care law and other ruling,president - elect barack obama,u.s. president barack obama,-pron- new plan to replace former president barack obama 's clean power plan ( cpp ) on tuesday,famously brilliant former president barack obama,"barack obama , or john kerry","jody freeman , a climate adviser to president barack obama who now teach at harvard law school","barack obama , john kerry , the eu , even some of the old - line environmental group","the us president , barack obama",the proposal president barack obama,us president barack obama,"joseph goffman , an epa official under president barack obama",glad president barack obama,barack obama and chinese president xi jinping,former president barack obama,"president barack obama , indian leader narendra modi",people like barack obama,president barack obama ’s,"fleming , an alum of president barack obama ’s domestic policy council",’ former president barack obama,president barack obama ’s secretary of energy ernest moniz,president barack obama on monday,president barack obama,barack obama ’s adviser ben rhodes,"""president barack obama"
Facebook,facebook,facebook ’s,facebook twitter pinterest jocelyn cockburn,some of facebook ’s own employee,facebook ceo mark zuckerberg,facebook founder mark zuckerberg,facebook representative,factbook
Bernie Sanders,bernie sanders (,bernie sanders,bernie sanders ’,— bernie sanders (,sen. bernie sanders,bernie sanders 's,bernie sanders ’s,— bernie sanders ( @berniesanders ),sens . barbara boxer ( d - calif . ) and bernie sanders ( i - vt . ),new hampshire — bernie sanders,bernie sanders and hillary clinton,democratic presidential candidate sen. bernie sanders (,some progressive voter who support sen. bernie sanders in the primary,democratic presidential candidate bernie sanders,vermont sen. bernie sanders,bernie sanders and elizabeth warren,"elizabeth warren and bernie sanders , among other",2020 presidential hopeful sen. bernie sanders,new hampshire — senator bernie sanders,sen. bernie sanders ( d - vt . ),democratic presidential candidate sen. bernie sanders ( vt . ),presidential hopeful sen. bernie sanders ( i - vt ),sen. bernie sanders ( i - vt ),"both sen. bernie sanders , -pron- - vt . and sen. elizabeth warren , d - mass",independent senator bernie sanders,presidential candidate sen. bernie sanders ( i - vt . ),democratic presidential candidate sen. bernie sanders ( i - vt . ),senator bernie sanders of vermont,presidential hopeful senator bernie sanders,sen. bernie sanders ( i - vt . )
Xi Jinping,' xi jingping,president xi jinping of china,president xi jinping,barack obama and chinese president xi jinping,president obama and president xi jinping of china,mr. xi ’s dilemma
Hillary Clinton,hillary clinton,hillary clinton ’s,state hillary clinton,hillary rodham clinton,bernie sanders and hillary clinton,democratic presidential hopeful hillary clinton,front - runner hillary clinton,a jovial hillary clinton,former democratic presidential candidate hillary clinton,democratic nominee hillary clinton,secretary of state hillary clinton,democratic presidential candidate hillary clinton,democratic presidential front - runner hillary clinton,"the last democratic nominee for president , hillary clinton , defend fracking and disparage environmental activist",president obama and hillary clinton,presidential candidate hillary clinton,democratic presidential nominee hillary clinton,twice - fail presidential candidate hillary clinton,hillary clinton floats conspiracy that tulsi gabbard,former secretary of state hillary clinton,democratic presidential nominee former secretary of state hillary clinton,"lead neoconservative hawk robert kagan , who will be a featured speaker at a clinton campaign fund - raiser soon",the clinton foundation ’s,mrs. clinton ’s strategist,democrats like bill clinton and barack obama,clinton campaign manager john podesta,former us president bill clinton,official travel with mrs. clinton,"judge david tatel , an appointee of president bill clinton",secretary of state hillary rodham clinton
Joe Biden,joe biden,joe biden ( d ),joe biden 's,joe biden ’s,@joebiden,democrat frontrunner joe biden,former vice president joe biden,democratic presidential front - runner joe biden,democratic presidential candidate joe biden,senator joe biden,former vice president joe biden ( d ),what joe biden,[ biden ],the lightbulbformer vice president joe biden,democrat frontrunner joe biden ( d ),new hampshire — joe biden,vice president joe biden,west virginia sen. joe manchin,the biden line,""" meteorologist joe bastardi",the tea party - back republican representative joe walsh of illinois,accce chief spokesman joe lucas,iowa political commentator former vice president joseph r. biden jr.,biden and 17 other presidential candidate,"joe moll , executive director of the mckenzie river trust",meteorologist joe bastardi,canadian natural resources minister joe oliver,mr. biden at multiple point in -pron- senate career,joe scarborough,senator joe manchin ( d - wv )
Elizabeth Warren,elizabeth warren,sen. elizabeth warren,elizabeth warren for president,democratic presidential candidate sen. elizabeth warren ( d - mass . ),bernie sanders and elizabeth warren,an invigorated elizabeth warren,"elizabeth warren and bernie sanders , among other",democratic 2020 presidential hopeful elizabeth warren,senator elizabeth warren of massachusetts,"presidential candidate sen. elizabeth warren , d - mass",democratic presidential hopeful sen. elizabeth warren,sen. elizabeth warren to whom the question about bernie bros be first direct,"both sen. bernie sanders , -pron- - vt . and sen. elizabeth warren , d - mass",sen. elizabeth warren ( d - mass,democratic presidential candidate elizabeth warren,"sens . bernie sanders of vermont and elizabeth warren of massachusetts as well as south bend , indiana , mayor pete buttigieg","sen. elizabeth warren of massachusetts , one of the top tier contender for the democratic nomination for president",massachusetts senator elizabeth warren,senators elizabeth warren ( d - mass,presidential candidate sen. elizabeth warren,sen. elizabeth warren ( d - ma ) : fight corruption and the influence of money in politic,cory booker tulsi gabbard amy klobuchar pete buttigieg elizabeth warren joseph,democratic presidential candidate sen. elizabeth warren,senator elizabeth warren,"sen. elizabeth warren , d - mass",massachusetts sen. elizabeth warren,elizabeth warren of massachusetts,https://t.co/ud6g53icnv — elizabeth warren ( @ewarren ),sen. elizabeth warren ( massachusetts ),sen. elizabeth warren ( d - ma )
Al Gore,— al gore,al gore,""" al gore",[ al ] gore,al 's gore,’s al gore,al gore 's,no al gore,al gore 's climate change organization,vice president al gore,nashville — al gore,former us vice - president al gore,former vice - president al gore,al gore have not be the messenger,lead climate change activist al gore,climate reality founder al gore,"al gore , the climate crusader and former vice president",former u.s. vice president al gore,climate prophet al gore,climate genius al gore,nobel peace prize - winner al gore,al gore -pron-,presidential candidate al gore,— al gore ( @algore ),former vice president al gore,-pron- ’s worth ask al gore,al gore and some other dude,former democratic vice president al gore,another vice president  al gore ,climate activist al gore
Nancy Pelosi,nancy pelosi,nancy pelosi ’s,u.s. house speaker nancy pelosi,house speaker nancy pelosi ( d - ca ),house speaker nancy pelosi ( d - calif . ),washington — speaker nancy pelosi,speaker nancy pelosi ( california ),speaker of the house nancy pelosi,house speaker nancy pelosi,house minority leader nancy pelosi,"nancy pelosi , d - calif",speaker of the house nancy pelosi ( d - calif . ),presumptive house speaker nancy pelosi,democratic house speaker nancy pelosi,speaker nancy pelosi,“ house speaker nancy pelosi,"the house speaker , nancy pelosi","the office of nancy pelosi , the speaker of the house of representatives","nancy knowlton , a marine scientist with the smithsonian institution museum of natural history",representative pelosi,cdc ’s nancy messonnier,"some of the tea party freshman who come to power in 2010 rail against the “ pelosi liberal """,coral scientist nancy knowlton at the smithsonian institution in washington,county council member roger berliner and nancy navarro,"nancy vogel , a spokeswoman for the california natural resources agency","holder , pelosi et al",pelosi and gingrich,pelosi and the democrats,longtime miami beach - base realtor nancy batchelor,california natural resources agency spokesperson nancy vogel
George W. Bush,george w. bush,george h.w. bush,george w. bush 's,george w. bush ’s,george p. bush,george hw bush,"john b. bellinger , who serve as a legal adviser in the administration of george w. bush",former president george w. bush,utah president george w. bush,""" a federal program implement under george w. bush",gov. george w. bush of texas,president george w. bush,"christine todd whitman , former republican governor of new jersey and epa chief under president george w. bush",pres­ident george w. bush,"henry paulson , a former wall street titan and treasury secretary under president george w. bush","the george w. bush administration , and senator james inhofe of oklahoma , an outspoken climate change denier —","jeffrey holmstead , former epa assistant administrator for air and radiation under george w. bush",george bush ’s,george prescott bush,"david shoemaker , president of the w.t.a. , who oversee the association ’s effort in that country","william k. reilly , administrator of the environmental agency under the first president george bush",– gop presidential candidate former new york gov. george pataki,chancellor george osborne,researcher at yale and george mason,writer george monbiot,ornithologist george divoky who have be study the black guillemot of cooper island for 45 year,state george shultz ( who drive an electric car power by solar panel on -pron- home ’s roof ),"the greek prime minister , george papandreou","george iranga , who manage the project","george whitten , a rancher in colorado ’s san luis valley"
Alexandria Ocasio-Cortez,alexandria ocasio - cortez,rep. alexandria ocasio - cortez,alexandria ocasio - cortez ( @aoc ),even alexandria ocasio - cortez,alexandra ocasio - cortez,u.s. rep. alexandria ocasio - cortez,rep.-elect alexandria ocasio - cortez ( d - ny ),reps . alexandria ocasio - cortez and chellie pingree,"ilhan omar , rashida tlaib , and alexandria in congress",rep. alexandria ocasio - cortez ( d - n.y. ),new us congresswoman alexandria ocasio - cortez,"other unhinge radical democrats – reps . alexandria ocasio - cortez of new york , ilhan omar of minnesota and rashida tlaib of michigan –",self - proclaim socialist rep. alexandria ocasio - cortez,new york democratic rep. alexandria ocasio - cortez,u.s. representative - elect alexandria ocasio - cortez,ocasio - cortez and -pron- fellow partisan hysteric,rep. alexandria ocasio - cortez ( d - ny ),democratic rep. alexandria ocasio - cortez,sen. bernie sanders ( i - vt ) and rep. alexandria ocasio - cortez ( d - ny ),freshman rep. alexandria ocasio - cortez ( d - n.y. ),"rep. alexandria ocasio - cortez , d - n.y. , the green new deal 's main sponsor in the house",democratic congressional candidate alexandria - ocasio cortez,new york congresswoman alexandria ocasio - cortez -- one of the green new deal 's democratic co - sponsor --,then - ocasio - cortez chief of staff saikat chakrabarti,congresswoman alexandria ocasio - cortez ( d - ny ),new york representative alexandria ocasio - cortez,freshman congresswoman alexandria ocasio - cortez,"freshman rep. alexandria ocasio - cortez , d - n.y.","rep. alexandria ocasio - cortez , d - n.y."
Scott Pruitt,— scott pruitt,scott pruitt,scott pruitt 's,epa chief scott pruitt,"epa administrator scott pruitt , white house press secretary sean spicer , and trump -pron-",there ’s no happy person in america right now than scott pruitt,environmental protection agency chief scott pruitt,incoming administrator scott pruitt be do the lord ’s work,"scott pruitt , head of the environmental protection agency",administrator scott pruitt,"scott pruitt , the newly confirm administrator of the environmental protection agency",the newly appoint environmental protection agency administrator scott pruitt,environmental protection agency head scott pruitt,the lightbulbenvironmental protection agency chief scott pruitt,former epa administrator scott pruitt,agency administrator scott pruitt,new environmental protection agency administrator scott pruitt,administrator scott pruitt ’s,the lightbulbenvironmental protection agency administrator scott pruitt,oklahoma attorney general scott pruitt,"scott pruitt , the agency administrator",epa administrator scott pruitt,trump 's epa chief scott pruitt,"scott pruitt , the current head of the us environmental protection agency",( epa ) administrator scott pruitt ’s,epa ) administrator scott pruitt,agency head scott pruitt,"scott pruitt , the man president trump appoint to lead the environmental protection agency","the agency ’s administrator , scott pruitt","scott pruitt , administrator of the environmental protection agency"
Tedros Adhanom Ghebreyesus,"tedros adhanom ghebreyesus , the world health organization ’s director general","dr. tedros adhanom ghebreyesus , the director general of the world health organization","dr. tedros , who have the backing of the african union and have be praise by international aid official and former president george w. bush"
Greta Thunberg,greta thunberg,w/ greta thunberg,child activist greta thunberg,youth activist greta thunberg,advertisementenvironment activist greta thunberg,swedish teen climate activist greta thunberg,poster child greta thunberg,greta thunberg — the teen activist who go,16-year - old greta thunberg,teen climate activist greta thunberg,greta thunberg from sweden,the anti - greta thunberg,leave - wing climate activist greta thunberg,teenage climate activist greta thunberg,environmental activist greta thunberg for elevate awareness of climate change,teenage greta thunberg,switzerland — greta thunberg,swedish teenager greta thunberg,""" greta thunberg 's father",teen climate change activist greta thunberg,swedish climate worrier greta thunberg,teenage climate change activist greta thunberg,— greta thunberg ( @gretathunberg ),teen environmental activist greta thunberg,swedish teen climate change activist greta thunberg,the young climate activist greta thunberg,teen activist greta thunberg,"a nice lady who have come dress as a narwhal for the greta thunberg rally in britain ’s green city , bristol",teen climate change activist – include greta thunberg and jamie margolin –,16-year - old swedish climate activist greta thunberg
Anthony Fauci,anthony fauci,dr. anthony fauci,dr anthony fauci,anthony s. fauci,white house coronavirus task force member dr. anthony fauci,"dr. anthony fauci , an infectious disease expert and a member of the white house coronavirus task force",even dr. anthony fauci,anthony fauci and deborah birx,"anthony fauci , director , national institute of allergy and infectious disease",respected public health expert anthony fauci,"dr. anthony fauci , the u.s. government 's top infectious disease expert","the top u.s. infectious disease official , dr. anthony fauci",coronavirus task force member dr. anthony fauci,"anthony fauci , director of the national institute of allergy and infectious diseases",dr. anthony fauci of the national institutes of health,"dr. anthony fauci , the head of the national institute of allergy and infectious diseases","dr. anthony fauci , director of the national institute of allergy and infectious diseases",niaid ’s anthony fauci,dr. anthony fauci of the u.s. national institutes of health,dr anthony fauci of the national institutes of health,"'dr. anthony fauci , director of the national institute of allergy and infectious diseases","dr. anthony fauci , director of the national institute of allergy and infectious diseases ( niaid )","dr. anthony fauci , the director of the national institute of allergy and infectious disease",newark public safety director anthony ambrose,dr. birx and dr. fauci,dr. fauci ( among other ),infectious - disease expert anthony s. fauci,dr. fauci ’s paper in the new england journal,"anthony s. fauci , director of the national institute of allergy and infectious diseases","dr. anthony s. fauci , the lead infectious disease expert in the u.s."
Mitch McConnell,mitch mcconnell,republican senate majority leader mitch mcconnell,"mitch mcconnell , the senate majority leader",senator mitch mcconnell,"senator mitch mcconnell of kentucky , the party leader",senate majority leader mitch mcconnell,kudo to senate majority leader mitch mcconnell for schedule a vote on the green new deal today,a poetic - feel sen. mitch mcconnell ( r - ky . ),senate majority leader mitch mcconnell of kentucky,“ senate majority leader mitch mcconnell,senate majority leader mitch mcconnell ( kentucky ),senate majority leader mitch mcconnell ( r - ky . ),majority leader mitch mcconnell ( r - ky . ),majority leader mitch mcconnell,minority leader mitch mcconnell,most especially incoming majority leader mitch mcconnell,presumptive senate majority leader mitch mcconnell,kentucky senator mitch mcconnell,senate minority leader mitch mcconnell,senate majority leader mitch mcconnell 's ( r - ky . ),sen. mitch mcconnell ( r ) of kentucky in a june 4 briefing,sen. mitch mcconnell ( r - ky . ),income majority leader mitch mcconnell,senior policy advocate mitch jones,former assistant secretary of energy charles mcconnell
Mike Pence,mike pence,veep candidate mike pence,indiana governor mike pence,vice president - elect mike pence,u.s. vice president mike pence,"mike pence , vice presidentindiana governor mike pence",vice president mike pence,republican gov. mike pence,indiana gov. mike pence in the news,"mike pence , vice president , united state",mini mike bloomberg,billionaire mike bloomberg,secretary of state mike pompeo,sen. mike rounds ( r - sd ),mike maclean ’s,mike rounds ( r - s.d. ): rounds,mike donohue of orange & rockland utilities,washington post letter editor mike larabee,bp attorney mike brock,"sen. mike lee , r - utah","rovaniemi , finland — secretary of state mike pompeo","mike blocher , the quarter horse rancher","former gov. mike huckabee , a top supporter of trump","rep. mike turner , r - ohio",american petroleum institute chief executive mike sommers,( uk ) space physicist mike lockwood,us secretary of state mike pompeo,gov. mike dewine of ohio,"the captain , a canadian name mike",axios executive editor mike allen
Andrew Cuomo,andrew cuomo,gov. andrew cuomo,gov andrew cuomo,— andrew cuomo ( @nygovcuomo ),new york democratic gov. andrew cuomo,democratic new york governor andrew cuomo,gov. andrew cuomo ( d - ny ),new york gov. andrew cuomo ( d ),gov. andrew cuomo of new york,"the governor , andrew cuomo",the empire state 's governor andrew cuomo,new york democrat gov. andrew cuomo,new york gov. andrew cuomo,"andrew cuomo , the governor of new york state",gov. andrew cuomo in the new york times,— new york gov. andrew cuomo,governor andrew cuomo of new york on tuesday,democratic new york gov. andrew cuomo,"new york ’s governor , andrew cuomo",new york 's governor andrew cuomo,governor andrew cuomo,gov. andrew cuomo d - n.y.,gov. andrew cuomo ( d ),new york governor andrew cuomo,"andrew westacott , the chief executive of the australian grand prix corporation","instance , new york gov. andrew m. cuomo ( d )",entrepreneur andrew yang,former democratic presidential candidate andrew yang,septa spokesperson andrew busch,unemployment woes cuomo
Bill McKibben,bill mckibben,bill mckibben ’s,bill mckibben of 350.org,350.org founder bill mckibben,"writer like bill mckibben , naomi klein , mark hertsgaard , james hansen , and chris hayes",— bill mckibben ( @billmckibben ),keystone.”—bill mckibben,author bill mckibben,"also : bill mckibben , founder of 350.org , on the global climate movement",even nation contributor bill mckibben,activist bill mckibben,journalist bill mckibben,author bill mckibben ( nancie battaglia ),"bill mckibben , who found 350.org and have lead the fight to stop the keystone xl pipeline",an energy and climate bill,democrats like bill clinton and barack obama,mayor bill de blasio of new york,former us president bill clinton,television host bill nye,a bill that could lead to light evening in the uk,the advocate of a comprehensive bill to combat global warming,"democratic senator , lead by bill nelson of florida",the provision in the new bill,a summary of the tax extender bill circulate on k street,"bill milner , the former owner of a real estate agency in whitefish , mont.",a bill call — so - call,"judge david tatel , an appointee of president bill clinton",rep. bill cassidy ( r ),mayor bill de blasio,bill burtis of clean air cool planet
Mike Pompeo,mike pompeo,secretary of state mike pompeo,"rovaniemi , finland — secretary of state mike pompeo",us secretary of state mike pompeo,trump ’s prospective new secretary of state mike pompeo,mini mike bloomberg,billionaire mike bloomberg,veep candidate mike pence,sen. mike rounds ( r - sd ),indiana governor mike pence,mike rounds ( r - s.d. ): rounds,mike donohue of orange & rockland utilities,washington post letter editor mike larabee,bp attorney mike brock,"sen. mike lee , r - utah",vice president - elect mike pence,"mike blocher , the quarter horse rancher","former gov. mike huckabee , a top supporter of trump","rep. mike turner , r - ohio",u.s. vice president mike pence,american petroleum institute chief executive mike sommers,( uk ) space physicist mike lockwood,gov. mike dewine of ohio,"the captain , a canadian name mike",axios executive editor mike allen,"mike pence , vice presidentindiana governor mike pence",former new york mayor mike bloomberg,vice president mike pence,""" san francisco resident mike vladimer",oipa president mike terry
Bill de Blasio,bill de blasio,mayor bill de blasio,mayor bill de blasio of new york,new york mayor bill de blasio,new york city mayor bill de blasio,bill mckibben of 350.org,350.org founder bill mckibben,an energy and climate bill,democrats like bill clinton and barack obama,"writer like bill mckibben , naomi klein , mark hertsgaard , james hansen , and chris hayes",— bill mckibben ( @billmckibben ),"yvo de boer , executive secretary of the united nations ’ climate change office",former us president bill clinton,television host bill nye,a bill that could lead to light evening in the uk,"tina van de flierdt , a professor of isotope geochemistry at imperial",the advocate of a comprehensive bill to combat global warming,-pron- ’s treat [ de souza ] like -pron- mate,"democratic senator , lead by bill nelson of florida","steven maviglio , spokesman for californians for clean energy & jobs , an alliance support the climate bill",the provision in the new bill,keystone.”—bill mckibben,"the un 's top climate official , yvo de boer",a summary of the tax extender bill circulate on k street,"bill milner , the former owner of a real estate agency in whitefish , mont.","francisco espárrago , the chairman of señorío de montanera , a midsize producer of ham",a bill call — so - call,"yvo de boer , outgoing un climate chief","judge david tatel , an appointee of president bill clinton",rep. bill cassidy ( r )
Pete Buttigieg,pete buttigieg,— pete buttigieg,mayor pete buttigieg,democratic presidential candidate pete buttigieg,democratic presidential hopeful pete buttigieg,""" former mayor pete buttigieg ( d )",former mayor pete buttigieg,cory booker tulsi gabbard amy klobuchar pete buttigieg elizabeth warren joseph,presidential hopeful pete buttigieg,south bend mayor pete buttigieg,indiana mayor pete buttigieg,"pete buttigieg , the former mayor of south bend , indiana",former south bend mayor pete buttigieg,klobuchar and buttigieg,reclamation spokesman pete lucero,gop strategist pete snyder,mr. buttigieg ’s fund - raising,"the team , lead by university of minnesota researcher pete turner",fox news ' pete hegseth,buttigieg and minnesota sen. amy klobuchar
