Brendan Murphy,brendan murphy,"professor brendan murphy , the australian government ’s chief medical officer",australian chief medical officer brendan murphy,chief medical officer brendan murphy,professor brendan murphy,australia 's chief medical officer professor brendan murphy,australia 's chief medical officer brendan murphy,sen. chris murphy ( d - conn . ),"the story of tom cotton , the senator who see the coronavirus come , and michael brendan dougherty",governor phil murphy ( d ),new jersey gov. phil murphy ( d ),democratic sen. chris murphy of connecticut,gov. philip d. murphy,"cuomo , connecticut gov. ned lamont and new jersey gov. phil murphy",rep. brendan boyle ( d - pa,"brendan babb , an official with the city of anchorage",new york times spokeswoman eileen murphy,new jersey gov. phil murphy,new jersey governor phil murphy,professor brendan wren from the london school of hygiene and tropical medicine,brendan smialowski / afp via getty images,gov. phil murphy of new jersey,democrat chris murphy,leicester city manager brendan rodgers,"gov. philip d. murphy of new jersey , which have have more death than any other state besides new york",administrative judge brendan sheehan,gov. philip d. murphy of new jersey,cambodia w. patrick murphy,-pron- colleague tim murphy
Neil Ferguson,neil ferguson,[ neil ] ferguson,neil ferguson 's,scientist and imperial college author neil ferguson,"prof neil ferguson ’s team at imperial college london , who carry out disease model for the who","professor neil ferguson , of imperial college london",professor neil ferguson from imperial college london,"prof neil ferguson , whose modelling be guide whitehall 's strategy",a team of public health expert lead by professor neil ferguson,epidemiologist neil ferguson,"professor neil ferguson , an epidemilogist at imperial college london and co - author of the report",neil ferguson of imperial college london,early models : flaw and shortcomingsneil ferguson at imperial college,"professor neil ferguson , one of the author of the report","prof neil ferguson ’s team at imperial college , who carry out disease model for the who",scientific adviser ferguson,ketchum mayor neil bradshaw,"neil albrecht , executive director of the city ’s election commission",union president eric ferguson,"the 19-year - old and -pron- father , neil shaffer",superintendent shaun ferguson,washington state attorney general bob ferguson,"neil bradley , the executive vice president and chief policy officer at the u.s. chamber of commerce",u.k. medium correspondent neil sean
Ma Xiaowei,ma xiaowei,health minister ma xiaowei,"china ’s health minister , ma xiaowei",chinese health minister ma xiaowei,china health minister ma xiaowei,national health minister ma xiaowei,china 's national health commission minister ma xiaowei,china ’s health minister ma xiaowei,"jack ma , the founder of e - commerce conglomerate alibaba",hong kong political scientist ma ngok,ms. ma and -pron- family,"dr. ma , the director of china ’s national health commission",chinese billionaire jack ma,alibaba co - founder jack ma,sen. elizabeth warren ( d - ma ),chinese vice minister of foreign affairs ma zhaoxu,"ma guoqiang , the municipal communist party secretary for wuhan",rep. ayanna pressley ( d - ma )
Paul Ehrlich,one dr. paul offit,paul pennock of weitz & luxenberg,"another parent , paul",paul joseph watson,"paul strangio , associate professor of politic and international relation at monash university",senator rand paul — a doctor,paul patriarca of the fda
Henry Waxman,henry waxman,senator sheldon whitehouse and representative henry waxman,rep. henry waxman ’s ( d - calif . ),house energy & commerce committee chair henry waxman,"the chair of the house oversight committee , rep. henry waxman ( d ) of california","the american clean energy and security act , pass in 2009 ( earlier know as waxman - markey )",stephen henry schneider,ford founder henry ford,former bush administration treasury secretary henry paulson,afscme district council 37 executive director henry garrido,congressman waxman,gov. henry mcmaster,henry david thoreau,"henry paulson , a former wall street titan and treasury secretary under president george w. bush",henry lin and collaborator at the harvard – smithsonian center for astrophysic,"henry lucero , deputy executive associate director for ice ’s enforcement and removal operations"
Lisa Friedman,lisa friedman,new york times climate change reporter lisa friedman,lisa friedman gov. jerry brown of california,reporter lisa friedman,senate energy committee chairman lisa murkowski ( r - alaska ),"stanford ’s associate vice president for communication , lisa lapin","glaspie 's friend , lisa brake",republican sens . susan collins of maine and lisa murkowski of alaska,"the e.p.a. ’s administrator , lisa p. jackson","lisa magnino , a spokeswoman for starbucks ,starbucks",cat lover lisa harris,the times ' friedman,lisa song at propublica,"lisa p. jackson , the e.p.a. administrator","david friedman , the group ’s deputy director for clean vehicle",lisa chalk from animals australia,sen. lisa murkowski ( r - ak ),"lisa jackson , the epa chief",sen. lisa murkowski ( r - alaska ),former epa administrator lisa jackson,lisa heller boragine,epa administrator lisa p. jackson,"stella ’s mother , lisa",environmental protection agency administrator lisa jackson,""" panelist lisa boothe",alaska republican sen. lisa murkowski,a lawyer for donziger — richard friedman —,"lisa p. jackson , the new e.p.a. administrator","lisa jackson , "" whom obama have choose as mr. johnson ’s successor","sen. lisa murkowski , r - alaska"
George Washington,president george washington,"scott pace , the director of george washington university ’s space policy center",george washington 's concern about party,a team of researcher at george washington university and the university of puerto rico,"mike taylor , a professor at the school of public health and health services at george washington uni­versity in washington","the first witness , jonathan turley of george washington university law school",political scientist sarah binder of george washington university,"william k. reilly , administrator of the environmental agency under the first president george bush",– gop presidential candidate former new york gov. george pataki,washington governor jay inslee,researcher at yale and george mason,governor jay inslee in washington,— washington gov. jay inslee,"dr. beth ebel , an associate professor of pediatric at the university of washington",the nicest guy in washington,"jared bierbach , an environmental protection specialist for the u.s. department of energy in washington , d.c.",ornithologist george divoky who have be study the black guillemot of cooper island for 45 year,state george shultz ( who drive an electric car power by solar panel on -pron- home ’s roof ),the washington post ’s andrew freedman,"the greek prime minister , george papandreou","george iranga , who manage the project",washington post columnist eugene robinson,"study co - author john harrison , an associate professor at washington state university ’s school of the environment","john b. bellinger , who serve as a legal adviser in the administration of george w. bush","-pron- point man in washington , interior secretary james g. watt","melanie corrigan , director of national initiative for the american council on education in washington",former president george w. bush,"william frey of brookings , lilliana mason of the university of maryland and justin gest of george mason university","george whitten , a rancher in colorado ’s san luis valley",washington gov. jay inslee ( d )
Chad Wolf,exclusive – acting homeland security secretary chad wolf,there ’s a bit of gray wolf and coyote in the dna of red wolf,-pron- privacy policyopponents of wolf hunting and trapping,the wolf of wall street actor - turn - political activist,yesterday pennsylvania gov. tom wolf,chad mayes ( @chadmayesca ),hunting moose in canada to save caribou from wolf ],california state legislator chad mayes,city manager chad adams,eight of the beginner have wolf permit,chad t. hanson,the gubernatorial ticket of tom wolf and fetterman,cnn meteorologist chad myers
Jennifer Nuzzo,"jennifer nuzzo , an epidemiologist and senior scholar at the johns hopkins center for health security","jennifer nuzzo , a senior scholar at the johns hopkins center for health security","jennifer haller , 43 , of seattle","-pron- lab director , jennifer rakeman , an assistant commissioner in the new york city health department",former disney actress jennifer stone,top civilian investigator jennifer zeng,st. louis university sophomore jennifer cheun,jennifer b. nuzzo of the johns hopkins center for health security,"jennifer ehrlich , a spokeswoman for minnesota - base 3 m"
Ivanka Trump,ivanka trump,white house adviser ivanka trump,"— donald j. trump ( @realdonaldtrump ) september 4 , 2019",md. — president donald trump,president donald trump,donald trump ’s election,trump and -pron- deputy,president donald trump ’s withdrawal of the us from the paris climate agreement,first son donald trump jr.,"gary cohn , chairman of the national economic council — that is , trump ’s own chief economist",how would -pron- china policy differ from president trump ’s,trump campaign manager kellyanne conway,– president donald trump,president donald j. trump,the automaker stand up to trump,the trump administration ’s,even trump ’s defense secretary james mattis,ivanka and jared kushner,mr. trump ’s previous tax plan,los angeles — president donald trump,"pruitt , the head of trump 's environmental protection agency",carlos barria / reuters trump,"epa administrator scott pruitt , white house press secretary sean spicer , and trump -pron-","mr. trump , who campaign on a pledge to revive the coal industry",[ the new trump white house,trump appointee james mattis,president trump and french president emmanuel macron,trounce donald trump be essential to the preservation of liberal democracy,trump ’s supporter in coal country,the great mr. donald trump
Kim Jong-un,organiser of the un - sponsor cop21 climate conference in paris,reality television star kim kardashian,georgia tech climate scientist kim cobb,obama 's un speech,the un 's climate change chief,even un secretary general ban ki moon,former un secretary general ban,a ct scan of kim ’s brain,"the un 's top climate official , yvo de boer",un chief antonio guterres,"yvo de boer , outgoing un climate chief",former canadian prime minister kim campbell,un ambassador nikki haley,roger kim of apen,another un report,un general assembly president maria espinosa,un climate chief christiana figueres,the un climate chief christiana figueres,"josh , who one year grant kim ’s birthday",the un intergovernmental panel on climate change ( ipcc ),un assistant secretary general robert orr,the un world meteorological organisation,nrdc senior scientist kim knowlton,"christiana figueres , the un 's top climate change official",the un conference,ex - canadian prime minister kim campbell,"christiana figueres , the un climate chief",the post ’s seung min kim,former un secretary general kofi annan,the un climate change chief
Aaron Rupar,sierra club president aaron mair,aaron huertas of the union of concerned scientists,bafta head of industry sustainability aaron matthews,"-pron- email newsletter aaron davis , a british botanist",aaron traywick ( leave ),"aaron eisenberg , a climate activist with the nyc democratic socialists of america","aaron mize , the refuge manager","aaron d. flesch , a research scientist at the university of arizona",western priorities spokesman aaron weiss,forest ethics campaign director aaron sanger
Michael Bennet,new hampshire – sen. michael bennet of colorado,sen. michael bennet ( d - who ? ),democratic sen. michael bennet of colorado,sen. michael bennet ( d - co ),"georgetown historian michael kazin , an expert in the radical left",michael mann from pennsylvania state university,administrator michael d. griffin,"michael bomford , a scientist at kentucky state university who specialize in sustainable agriculture","michael mann , a lead climate scientist and professor of meteorology at penn state university","the lawsuit , which michael shellenberger of environmental progress spotlight in -pron- recent forbes column",king county superior court judge michael scott,former new york city mayor michael bloomberg,climatologist michael mann ( who have push agw on the public for decade ) against retire professor dr. tim ball,u.s. district judge michael simon,"co - founder and german chemist , michael braungart",orange county water official michael markus,president michael p. farris,stanford environmental law professor michael wara,act australian high commissioner michael hunt,author michael burger,"example : james hansen , michael shellenberger , and stewart brand",designer michael kors,aaa public relation manager michael green,"michael pollan , author of the omnivore 's dilemma : a natural history of four meals",progressive activist michael moore,climate scientist michael mann,"michael mann , director of the earth system science center at penn state university",penn state university climate scientist michael mann,"michael soukup , a former associate director for natural - resource stewardship and science at the nps","michael burger , executive director of the sabin center for climate change law at columbia university"
Forbes,forbes,forbes 's tim worstall,alex epstein at forbes,mr. forbes
Christopher Monckton,lord christopher monckton,viscount christopher monckton of brenchley,"christopher monckton , the viscount monckton of brenchley ( uk )",the post ’s christopher ingraham,christopher weber and h. scott matthews ’ study,lord monckton - a former adviser to margaret thatcher,"christopher bendiksen , head of research at coinshares and a contributor to the recent report",""" university of south carolina archaeologist christopher moore","christopher barr , a forest policy expert with the us - base consulting firm woods & wayside international","the rev. christopher montella of st. stephen ’s episcopal church , not far from the high school",anthropologist christopher dana lynn,atsdr director christopher portier,william stein and christopher berry,marine scientist christopher reddy of the blow - out 's environmental aftermath,"christopher r. knittel , a professor of applied economic at mit , in response to the eia finding","lord monckton , an independent researcher and activist",energy modeler christopher clack ( formerly of noaa ),christopher field of the carnegie institution for science,"roger pielke , tom wigley and christopher green",the third viscount monckton of brenchley,"lord monckton , a british politician , journalist , and note skeptic of global warming","christopher s. ellings , a salmon research biologist with the nisqually indian tribe","jakosky and -pron- collaborator , christopher edwards , an assistant professor of planetary science at northern arizona university in flagstaff","monckton , a former journalist and policy adviser to margaret thatcher , who have be the deputy leader of the uk independence party ( ukip ) since june",emily badger and christopher ingraham in the washington post,richard feely and dr christopher sabine –,modeler christopher clack of vibrant clean energy,christopher johnston
Kerry Emanuel,kerry emanuel,mit hurricane expert kerry emanuel,atmospheric scientist kerry emanuel of mit,"kerry emanuel , a hurricane expert at the massachusetts institute of technology",kerry emanuel of the massachusetts institute of technology who present two study,mit hurricane researcher kerry emanuel,""" secretary of state nominee john kerry",secretary of state john kerry,sen. john kerry ( d - mass . ),"barack obama , or john kerry",rep. emanuel cleaver ( d - mo ),"john “ swiftboat "" kerry","kerry mccarthy , a labour mp and member of the environmental audit committee",u.s. secretary of state john kerry,"senator john kerry , one of the lead proponent of cap - and - trade in the congress","kerry 's "" flat earth "" analogy","barack obama , john kerry , the eu , even some of the old - line environmental group",the state department – kerry,democrats close to mr. kerry,"jakarta , indonesia — secretary of state john kerry","mit 's emanuel , who be not involve in the research",former mayor rahm emanuel,gasbag john f. kerry,"john kerry , d - mass",new delhi — secretary of state john kerry,former secretary of state john kerry,"emanuel , a chicago mayoral candidate","-pron- negotiator , john kerry","john kerry , the former secretary of state under the last democratic administration",""" obama and secretary of state john kerry"
Ruth Bader Ginsburg,justice ruth bader ginsburg,liberal justice ruth bader ginsburg,"fellow liberal ruth bader ginsburg , sonia sotomayor and elena kagan",supreme court justice ruth bader ginsburg,"justice stevens , join by justices anthony m. kennedy , david h. souter , ruth bader ginsburg and stephen g. breyer",caroline bader of the geneva - base lutheran world federation,astronomer adam ginsburg of the national radio astronomy observatory,"ruth gates , director of the hawaii institute of marine biology"
Greg Hunt,greg hunt,federal environment minister greg hunt,environment minister greg hunt,"state representative greg bonnen , a republican from suburban houston","hunt , fish , boat , ski , swim , and hike",gary michael hunt,act australian high commissioner michael hunt,"cumming ’ friend austin hunt , a doctor who live in derriford , england",gov. greg abbott,"tony johnson , from richmond , who share a room with terry and greg","greg rouse , professor of marine biology at scripps institution","greg mullins , the former fire commissioner of new south wales",a black bear hunt,dr. kennedy ’s hunt for a cheatgrass killer,author greg palast,cbe senior scientist greg karras,governor greg abbott,"greg barker , the uk 's climate change minister","hunt , a former coal miner who live in martin county , kentucky",terry and greg,greg sargent of the washington post,texas governor greg abbott,aon chief executive officer greg case,greg grey cloud,"greg marshall , a garden designer in adelaide",william herbert hunt,uc berkeley molecular and cell biology professor greg barton,t&e ’s greg archer,greg van buskirk,greg blankenship
Robert Novak,energy research senior fellow robert murphy,father robert e. morey of saint anthony catholic church,biologist robert spaul,former congressman robert walker and economist peter navarro,"senators al gore of tennessee , william fulbright of arkansas , and robert byrd of west virginia",professor robert howarth,murkowski spokesman robert dillon,filmmaker robert greenwald,researchers robert deconto and david pollard,"robert litterman , co - founder of a hedge fund call kepos capital",walt disney co. chief executive robert iger,"robert sinclair jr. , a spokesman at aaa northeast",white house press secretary robert gibbs,then - chancellor robert birgeneau,energy analyst robert rapier,economist robert murphy with the institute for energy research,"robert zubrin , an aerospace engineer and founder of the mars society",the british explorer robert falcon scott,robert e. hart of florida state university,harvard university environmental economist robert stavins in a blog post write from lima,economist robert pindyck of the massachusetts institute of technology,geologist robert young,"robert larson , a resident of columbus , ohio , who ’s work on a phd in history",pic.twitter.com/mu5p9gbewh — robert colvile ( @rcolvile ),"robert diaz , a hypoxia expert from the virginia institute of marine science","robert h. williams , a physicist","former rep. robert francis "" beto "" o'rourke ( d - texas )",economist robert gordon,"steve bannon , robert mercer , americans","— robert socolow , an engineer , and stephen pacala , an ecologist"
Chris Cuomo,chris cuomo,chris cuomo ’s,cnn 's chris cuomo,cnn anchor chris cuomo,' cnn host chris cuomo,"chris hopson , chief executive of nhs provider",sen. chris murphy ( d - conn . ),gov. andrew cuomo,"instance , new york gov. andrew m. cuomo ( d )","professor chris whitty , the chief medical adviser to boris johnson",-pron- ask chris murray,— andrew cuomo ( @nygovcuomo ),democratic sen. chris murphy of connecticut,mcdonald ’s president and ceo chris kempczinski,new york democratic gov. andrew cuomo,democratic new york governor andrew cuomo,"the chief medical officer , professor chris whitty",gov. andrew cuomo ( d - ny ),unemployment woes cuomo,mcdonald 's ceo chris kempczinski,"cuomo , connecticut gov. ned lamont and new jersey gov. phil murphy",new york gov. andrew cuomo ( d ),"one scientist , professor chris wickramsinghe of the buckingham centre for astrobiology",new hampshire gov. chris sununu ( r ),police commissioner chris tang,chief medical officer chris whitty,gov. andrew cuomo of new york,the cuomo administration,england 's chief medical officer professor chris whitty,raymond james analyst chris meekins
Anderson Cooper,anderson cooper,@andersoncooper,cnn moderator anderson cooper,ornithologist george divoky who have be study the black guillemot of cooper island for 45 year,prof kevin anderson at the university of manchester,paramount pictures cooper ( matthew mcconaughey ),"josephine cooper , the president of the alliance of automobile manufacturers , a washington - base trade group","alice bows and kevin anderson , of the tyndall centre for climate change research at the university of manchester",anderson and -pron- colleague,dr. lawrence of cooper university medical center,"helene cooper , pentagon correspondent for the times","marcus anderson , a resident of windsor heights , iowa",former salt lake city mayor rocky anderson,"angela anderson , program director for the us climate action network","kevin anderson , of the uk 's tyndall centre for climate change research","mark anderson , the chief executive of the parent company connect airways",gov. roy cooper of north carolina,"scott anderson , a senior policy adviser at the environmental defense fund in austin , texas","ryan cooper write for the week ,"
Xavier Becerra,attorney general xavier becerra,california attorney general xavier becerra,"xavier becerra , the state attorney general","the experiment , conduct by joao xavier of memorial sloan - kettering cancer center","xavier bettel , luxembourg ’s prime minister"
Steven Chu,steven chu,outgo secretary dr. steven chu,science and innovation minister steven joyce,"steven c. wofsy , a harvard professor and an author of the paper",secretary chu ’s resignation letter,phd candidate steven miller,steven d. levitt,the nobel physics laureate steven weinberg,u.s. treasury secretary steven mnuchin,author steven johnson,"the treasury secretary , steven mnuchin","steven rockefeller , a son of nelson a. rockefeller and a trustee of the fund",polar bears international ’s steven amstrup,the post 's steven mufson,canadian statistician steven mcintyre and ross mckitrick,"dr. chu , a physicist",the post ’s steven mufson,treasury secretary steven mnuchin,several flaw from blogger like steven goddard,"steven j. schueth , president of first affirmative",dr. steven abrams of texas children 's hospital,new york university professor steven koonin
Andrew Wakefield,andrew wakefield,dr. andrew wakefield,the appearance of andrew wakefield on good morning american,the biographical material about mr. wakefield,the co - author of wakefield ’s discredit study,pediatric neurologist dr. andrew zimmerman,entrepreneur andrew yang,the 1998 wakefield paper,new york governor andrew cuomo,a study of eight child publish in the lancet by dr. andrew j. wakefield
Michael Gove,enter environment secretary michael gove,michael govan,"georgetown historian michael kazin , an expert in the radical left",michael mann from pennsylvania state university,administrator michael d. griffin,"michael mann , a lead climate scientist and professor of meteorology at penn state university",king county superior court judge michael scott,former new york city mayor michael bloomberg,u.s. district judge michael simon,"co - founder and german chemist , michael braungart",orange county water official michael markus,president michael p. farris,stanford environmental law professor michael wara,act australian high commissioner michael hunt,author michael burger,"example : james hansen , michael shellenberger , and stewart brand",designer michael kors,aaa public relation manager michael green,"michael pollan , author of the omnivore 's dilemma : a natural history of four meals",progressive activist michael moore,climate scientist michael mann,"michael mann , director of the earth system science center at penn state university",penn state university climate scientist michael mann,ted nordhaus and michael schellenberger,liberal billionaire michael bloomberg,edelman spokesman michael bush,michael coe of the woods hole research center,michael halpern of the public interest group,bnef chair michael liebreich,university of virginia climate scientist michael mann
