Friends of Science,land regions such as the sahel of africa,the ministry of ecology and environment,"maria van der hoeven , the executive director of the international energy agency ( iea )","nikki rothwell , coordinator of the northwest michigan horticultural research center",-pron- register of interest from -pron- spell as an mp,"gaynor hartnell , chief executive of the renewable energy association","gareth redmond - king , wwf 's head of climate change",expert familiar with heede ’s research and the politic of climate change,"mr. cuylenburg of the resilience project , who travel around australia give talk on way to improve mental health",tim derk of the t - shirt cannon -pron- help invent when -pron- work as the coyote mascot for the san antonio spurs in the 1990s,"dr. roger a. pielke jr. , an expert on environmental risk at the university of colorado",science and economic and morality,"kaufman , the director of columbia ’s school of international and public affairs","marshall shepherd , the director of atmospheric sciences program , university of georgia",prof . mark lilla of columbia,"robert n. stavins , the director of the environmental economic program at harvard university who be in china recently to discuss climate change","dr ross thompson , of the institute for applied ecology at the university of canberra",terrorist basis inside of iraq,few of these obstacle have to do with a deliberate refusal to vote,mr. ward of the grantham institute,"that ’s the conclusion of the new study , write by henley and andrew king of the university of melbourne",juvenile turtle and other animal head toward the oil instead of away from -pron-,"a nobel prize win biochemistry professor robert lefkowitz of duke university , the poor performance of greenhouse gas theory in the survey","coal- and gas - fire electrical generating plant , and make and drive million of new car",representative tulsi gabbard of hawaii,"tom jordan , director of the southern california earthquake center and a co - author of the study","durwood zaelke , president of the institute for governance & sustainable development","the experiment , conduct by joao xavier of memorial sloan - kettering cancer center","the fur , skeleton , tooth , head , lash and whisker of the pup , name dogor",the law of physics and chemistry
Jim Bridenstine,jim bridenstine,mr. bridenstine,rep. jim costa ( california ),"jim rogers , the former chief executive of duke energy",franklin county sheriff office chief deputy jim gilbert,"jim goodbar , a cave and karst specialist employ by the blm in new mexico for 38 year before retire in january",the lead nasa climate scientist prof jim hansen,"senator jim inhofe ( r - ok ) , chairman of the senate environment and public works committee",heartland spokesperson jim lakely,climate scientist jim hansen,principal author jim thomas,trump nominee bridenstine,illinois state climatologist jim angel,"duke energy chief executive jim rogers , who have endorse a limit on carbon emission","jim bakker , a televangelist who be once catch up in a sex scandal and who spend four year in prison for fraud",sen. jim inhofe ( r - ok ),specifically live in the jim crow - era south,rep. jim jordan ( r - ohio ),"west virginia gov. jim justice , a democrat - turn - republican",heartland ’s jim lakely,"jim brewer , the organization ’s manage director of government affair and policy",virginia democrat jim webb,bronx zoo director jim breheny,liberal agriculture commissioner jim hightower,"jim balsillie , co - chief executive of blackberry maker research in motion",kentucky ’s jim bunning,police chief jim hughes,"congressman jim langevin ( d - r.i. ) , a member of the house armed service committee",secretary of defense jim mattis,"barton ’s gop colleague , jim sensenbrenner"
Ernesto Araújo
Climate change denialism,"gareth redmond - king , wwf 's head of climate change",expert familiar with heede ’s research and the politic of climate change,"robert n. stavins , the director of the environmental economic program at harvard university who be in china recently to discuss climate change",british climate scientist martin parry,a draft u.n. report on climate change,"a report in september by david mackay , the chief scientific adviser at the department of energy and climate change",a change of a couple of shareholder ' vote,a video that use a discussion of sport dope to explain the probability aspect of climate change,"david fenton , the founder of fenton , the social change communication agency that produce the ad",the national security risk of project climate change,"michael mann , a lead climate scientist and professor of meteorology at penn state university","sen. john barrasso ( r - wyo . ) , one of congress ’ fierce opponent of take official action on climate change",president donald trump ’s withdrawal of the us from the paris climate agreement,organiser of the un - sponsor cop21 climate conference in paris,"climate depot , run by the conservative non - profit committee for a constructive tomorrow ( cfact )",climate and economic - justice organizing across the country,al gore 's climate change organization,"the combination of "" the climate change "" and earth ’s grow human population be a recipe for disaster",european union climate commissioner miguel arias cañete,93 % of actively publish climate scientist,venezuela ’s lead climate negotiator claudia salerno,the lead nasa climate scientist prof jim hansen,georgia tech climate scientist kim cobb,a large leak could harm the climate and local population,independent climate researcher nick lewis,-pron- ’s not simply that -pron- want to understand the rule of the climate system ....,"physicist john schellnhuber , founder of the potsdam institute for climate impact research in germany",even be the doomi of doomsday prediction about climate change and rise sea level to come true,"jon costantino , a former climate change planner at the california air resources board who be now a senior adviser to the sacramento law firm manatt , phelps & phillips",greenpeace usa climate director janet redman
State of Fear,land regions such as the sahel of africa,the ministry of ecology and environment,"maria van der hoeven , the executive director of the international energy agency ( iea )","nikki rothwell , coordinator of the northwest michigan horticultural research center",-pron- register of interest from -pron- spell as an mp,"gaynor hartnell , chief executive of the renewable energy association","gareth redmond - king , wwf 's head of climate change",the estimate of damage,expert familiar with heede ’s research and the politic of climate change,schmidt of nasa goddard,""" ohio state university",not all of the meeting,a new cache of email,"dr. roger a. pielke jr. , an expert on environmental risk at the university of colorado","kaufman , the director of columbia ’s school of international and public affairs","marshall shepherd , the director of atmospheric sciences program , university of georgia",prof . mark lilla of columbia,"dr ross thompson , of the institute for applied ecology at the university of canberra",terrorist basis inside of iraq,few of these obstacle have to do with a deliberate refusal to vote,mr. ward of the grantham institute,"that ’s the conclusion of the new study , write by henley and andrew king of the university of melbourne",juvenile turtle and other animal head toward the oil instead of away from -pron-,"coal- and gas - fire electrical generating plant , and make and drive million of new car",representative tulsi gabbard of hawaii,"tom jordan , director of the southern california earthquake center and a co - author of the study","durwood zaelke , president of the institute for governance & sustainable development","the experiment , conduct by joao xavier of memorial sloan - kettering cancer center","the fur , skeleton , tooth , head , lash and whisker of the pup , name dogor",the law of physics and chemistry
Psychology of climate change denial,"maria van der hoeven , the executive director of the international energy agency ( iea )","nikki rothwell , coordinator of the northwest michigan horticultural research center","scad of scientist who think nuclear - waste storage be eminently manageable , include the national academies of sciences , engineering , and medicine",-pron- register of interest from -pron- spell as an mp,"gaynor hartnell , chief executive of the renewable energy association","gareth redmond - king , wwf 's head of climate change",expert familiar with heede ’s research and the politic of climate change,"mr. cuylenburg of the resilience project , who travel around australia give talk on way to improve mental health",tim derk of the t - shirt cannon -pron- help invent when -pron- work as the coyote mascot for the san antonio spurs in the 1990s,"dr. roger a. pielke jr. , an expert on environmental risk at the university of colorado","kaufman , the director of columbia ’s school of international and public affairs","marshall shepherd , the director of atmospheric sciences program , university of georgia","robert n. stavins , the director of the environmental economic program at harvard university who be in china recently to discuss climate change","dr ross thompson , of the institute for applied ecology at the university of canberra",few of these obstacle have to do with a deliberate refusal to vote,"that ’s the conclusion of the new study , write by henley and andrew king of the university of melbourne",juvenile turtle and other animal head toward the oil instead of away from -pron-,"a nobel prize win biochemistry professor robert lefkowitz of duke university , the poor performance of greenhouse gas theory in the survey","coal- and gas - fire electrical generating plant , and make and drive million of new car","tom jordan , director of the southern california earthquake center and a co - author of the study","durwood zaelke , president of the institute for governance & sustainable development","the experiment , conduct by joao xavier of memorial sloan - kettering cancer center","amanda gates , an energy design expert , award - win interior designer , advanced feng shui practitioner and host of the popular podcast home energy design","the fur , skeleton , tooth , head , lash and whisker of the pup , name dogor","brophy , one of the researcher in windsor , approve of the ban","a report in september by david mackay , the chief scientific adviser at the department of energy and climate change","opponent of duke ’s plan , include environmental group and local renewable energy producer",now that -pron- have map the whole edge of the ice sheet,a unanimous panel of the u.s. court of appeals for the district of columbia circuit,an $ 8 billion plan to revitalize a barren swath of san francisco
Climate Change Denial Disorder,"gareth redmond - king , wwf 's head of climate change",expert familiar with heede ’s research and the politic of climate change,"robert n. stavins , the director of the environmental economic program at harvard university who be in china recently to discuss climate change","a report in september by david mackay , the chief scientific adviser at the department of energy and climate change",a video that use a discussion of sport dope to explain the probability aspect of climate change,"david fenton , the founder of fenton , the social change communication agency that produce the ad",the national security risk of project climate change,"michael mann , a lead climate scientist and professor of meteorology at penn state university","sen. john barrasso ( r - wyo . ) , one of congress ’ fierce opponent of take official action on climate change",president donald trump ’s withdrawal of the us from the paris climate agreement,organiser of the un - sponsor cop21 climate conference in paris,"climate depot , run by the conservative non - profit committee for a constructive tomorrow ( cfact )",climate and economic - justice organizing across the country,"the combination of "" the climate change "" and earth ’s grow human population be a recipe for disaster",european union climate commissioner miguel arias cañete,venezuela ’s lead climate negotiator claudia salerno,the lead nasa climate scientist prof jim hansen,a large leak could harm the climate and local population,-pron- ’s not simply that -pron- want to understand the rule of the climate system ....,"physicist john schellnhuber , founder of the potsdam institute for climate impact research in germany",even be the doomi of doomsday prediction about climate change and rise sea level to come true,"jon costantino , a former climate change planner at the california air resources board who be now a senior adviser to the sacramento law firm manatt , phelps & phillips",a new united nations report on climate change,step forward australian climate scientist professor chris turney,friend of the earth climate campaigner asad rehman,"andrew dessler , climate scientist , texas a&m university",the percentage of white americans who say that -pron- believe climate change be a very serious problem decline during the obama administration,the intergovernmental panel on climate change -- a body make up of the world 's top climate scientist --,"the protester ' demand , which be that the college "" declare a climate emergency and immediately divest from fossil fuel","omar el - arini , a member of the climate fund ’s board"
Climate Audit,"steve mcintyre , a climate scientist and the editor of climate blog climate audit","gareth redmond - king , wwf 's head of climate change",expert familiar with heede ’s research and the politic of climate change,no conclusion about climate change,british climate scientist martin parry,a draft u.n. report on climate change,the wheel of climate action,the concern of climate change,the teen climate change activist,a video that use a discussion of sport dope to explain the probability aspect of climate change,the national security risk of project climate change,"michael mann , a lead climate scientist and professor of meteorology at penn state university",president donald trump ’s withdrawal of the us from the paris climate agreement,organiser of the un - sponsor cop21 climate conference in paris,"climate depot , run by the conservative non - profit committee for a constructive tomorrow ( cfact )",climate and economic - justice organizing across the country,al gore 's climate change organization,"the combination of "" the climate change "" and earth ’s grow human population be a recipe for disaster",european union climate commissioner miguel arias cañete,93 % of actively publish climate scientist,an energy and climate bill,venezuela ’s lead climate negotiator claudia salerno,the lead nasa climate scientist prof jim hansen,georgia tech climate scientist kim cobb,a large leak could harm the climate and local population,independent climate researcher nick lewis,-pron- ’s not simply that -pron- want to understand the rule of the climate system ....,"physicist john schellnhuber , founder of the potsdam institute for climate impact research in germany",even be the doomi of doomsday prediction about climate change and rise sea level to come true,greenpeace usa climate director janet redman
Brian Wilshire,u.s. district judge brian morris,famous food researcher brian wansink,brian merchant for motherboard at vice,"brian jacobs , a botanist with the national park service in bandelier",montana governor brian schweitzer,time 's brian bennett,freshman rep. brian fitzpatrick ( r - pa . ),denton municipal electric spokesperson brian daskam,"brian fuchs , a climatologist at the national drought mitigation center at the university of nebraska - lincoln",former gov. brian schweitzer ( montana ),"-pron- republican opponent , brian kemp",democratic hawaii sen. brian schatz,"university of colorado snow scientist mark williams and a fellow researcher , brian lazar at stratus consulting","brian d. taylor , a professor of urban planning at u.c.l.a.",chairman brian bitner,adair county coroner brian noe
Willie Soon,willie soon,the ocean will soon hold so much carbon that a mass extinction be inevitable,-pron- be too soon to change course,-pron- be too soon to tell how much the virus have affect china ’s market,astrophysicist willie,"-pron- think fossil fuel will end any time soon , maybe in 500 yrs"
John Hagee,u.s. attorney john durham,georgetown president john j. degioia,"defense attorney john simpson , a tall , mustachioed ex - marine",democratic rep. john lewis of georgia,john german of the international council on clean transportation,supreme court chief justice john roberts,2020 democrat john delaney,senate majority whip john thune ( r - s.d. ),former national security adviser john bolton,chief of staff john f. kelly,"john mcmanus , executive director of the golden gate salmon association",john p. holdren,white house counselor john podesta,chief justice john roberts,the uss john s. mccain,clinton campaign manager john podesta,cites director - general john scanlon,""" secretary of state nominee john kerry",john hofmeister,obama science czar john p. holdren,secretary of state john kerry,co - founder john mackey,"john raquet , the ceo and founder of industry publication gasworld",( uah ) climatologist john christy,white house chief of staff john kelly,white house national security advisor john bolton,president obama ’s science czar john holdren,john kasich of ohio,farmer john reifsteck from illinois,"john mcmanus , aep 's vice president of environmental service"
Harry Binswanger,just as harry be prepare to get on -pron- foot,prince harry and meghan markle,anaheim mayor harry sidhu,"harry s. truman , theodore roosevelt ’s daughter , alice",prince harry ’s reputation,senate minority leader harry reid ( d - nevada ),the summit - dub camp google - harry,harry and meghan 's instagram account,former u.s. senate majority leader harry reid,-pron- [ harry and meghan ],senate majority leader harry reid,harry and meghan 's official royal travel
Peter Felser,cambridge ’s peter wadhams,the post ’s peter holley,senate president peter courtney,peter shelley of the conservation law foundation,former congressman robert walker and economist peter navarro,chair of the house transportation and infrastructure committee rep. peter defazio ( d - or ),evergreen state college economist peter dorman,"peter o’neill , the prime minister of papua new guinea","peter styring , a professor at the university of sheffield",conservative mp peter luff,peter u. clark of oregon state university,vermont gov. peter shumlin ( d ),former ikea group ceo peter agnefjall,paypal co - founder peter thiel,nestlé chairman peter brabeck,university of cape town climate scientist peter johnston,peter styring of the university of sheffield,virologist peter doherty,"one member , peter bloomfield , a statistic professor at north carolina state university","peter houk , a coral reef specialist at the marine laboratory",professor peter frankopan,peter frumhoff of the union of concerned scientists,"peter sheehan , an economist at victoria university , australia",vermont governor peter shumlin,national farmers ' union president peter kendall,editor peter geiger,"r. peter calvert , the utility 's principal fuel planner",peter blanchard of the state department of environmental protection,"peter gleick , a climate scientist and president of the pacific institute","the company ’s chief executive , peter coleman"
The Heritage Foundation,ben lieberman of the heritage foundation,land regions such as the sahel of africa,the ministry of ecology and environment,"maria van der hoeven , the executive director of the international energy agency ( iea )","a solar physicist at the harvard - smithsonian center for astrophysics , and -pron- co - author","nikki rothwell , coordinator of the northwest michigan horticultural research center",the wall street journal editorial page,"scad of scientist who think nuclear - waste storage be eminently manageable , include the national academies of sciences , engineering , and medicine","gaynor hartnell , chief executive of the renewable energy association",the second - highest ranking woman in the vatican,expert familiar with heede ’s research and the politic of climate change,"mr. cuylenburg of the resilience project , who travel around australia give talk on way to improve mental health","the colleague , an assistant professor at another university",a resolution call for the green new deal,"-pron- ally would not dare call the december meeting a “ summit , "" nato official concede","presidential candidate michael bloomberg on sunday , the day before the national holiday honor martin luther king jr.",deputy chief matt barnes explain the ordinance,tim derk of the t - shirt cannon -pron- help invent when -pron- work as the coyote mascot for the san antonio spurs in the 1990s,"andrew raingold , executive director for the aldersgate group , which have campaign for the mandatory measure","dr. roger a. pielke jr. , an expert on environmental risk at the university of colorado","kaufman , the director of columbia ’s school of international and public affairs","marshall shepherd , the director of atmospheric sciences program , university of georgia","robert n. stavins , the director of the environmental economic program at harvard university who be in china recently to discuss climate change",the people who disagree with -pron- decision to birth strike now,"dr ross thompson , of the institute for applied ecology at the university of canberra","that ’s the conclusion of the new study , write by henley and andrew king of the university of melbourne",juvenile turtle and other animal head toward the oil instead of away from -pron-,"the british , french and german environmental minister","a nobel prize win biochemistry professor robert lefkowitz of duke university , the poor performance of greenhouse gas theory in the survey","prime minister scott morrison , who have be widely criticize for -pron- delay response to the fire"
Rainer Kraft,economy minister rainer bruederle,the company – such as kraft foods and frito - lay – whose product be divert from landfill
Yulia Latynina
Joana Cotar
Institute of Public Affairs,"maria van der hoeven , the executive director of the international energy agency ( iea )","nikki rothwell , coordinator of the northwest michigan horticultural research center","scad of scientist who think nuclear - waste storage be eminently manageable , include the national academies of sciences , engineering , and medicine",-pron- register of interest from -pron- spell as an mp,"gaynor hartnell , chief executive of the renewable energy association","gareth redmond - king , wwf 's head of climate change",expert familiar with heede ’s research and the politic of climate change,"mr. cuylenburg of the resilience project , who travel around australia give talk on way to improve mental health",tim derk of the t - shirt cannon -pron- help invent when -pron- work as the coyote mascot for the san antonio spurs in the 1990s,"dr. roger a. pielke jr. , an expert on environmental risk at the university of colorado","kaufman , the director of columbia ’s school of international and public affairs","marshall shepherd , the director of atmospheric sciences program , university of georgia","robert n. stavins , the director of the environmental economic program at harvard university who be in china recently to discuss climate change","dr ross thompson , of the institute for applied ecology at the university of canberra",few of these obstacle have to do with a deliberate refusal to vote,"that ’s the conclusion of the new study , write by henley and andrew king of the university of melbourne",juvenile turtle and other animal head toward the oil instead of away from -pron-,"a nobel prize win biochemistry professor robert lefkowitz of duke university , the poor performance of greenhouse gas theory in the survey","coal- and gas - fire electrical generating plant , and make and drive million of new car","tom jordan , director of the southern california earthquake center and a co - author of the study","durwood zaelke , president of the institute for governance & sustainable development","the experiment , conduct by joao xavier of memorial sloan - kettering cancer center","amanda gates , an energy design expert , award - win interior designer , advanced feng shui practitioner and host of the popular podcast home energy design","the fur , skeleton , tooth , head , lash and whisker of the pup , name dogor",mark s. davis of tulane university law school,"brophy , one of the researcher in windsor , approve of the ban","a report in september by david mackay , the chief scientific adviser at the department of energy and climate change","opponent of duke ’s plan , include environmental group and local renewable energy producer",now that -pron- have map the whole edge of the ice sheet,a unanimous panel of the u.s. court of appeals for the district of columbia circuit
Khabibullo Abdussamatov
